{
  "schema_version": "1.0.0",
  "kind": "page-realization-evidence",
  "page_id": "page_a11ca71000000001",
  "page_contract_sha256": "6a9c4ec946e3a234814ad178a135a2707f36fe920931b2f0df720dabfae4bfd7",
  "states": [
    { "id": "ready", "selector": "[data-cmz-id=\"ready\"]" },
    { "id": "submitted", "selector": "[data-cmz-id=\"submitted\"]" },
    { "id": "failed", "selector": "[data-cmz-id=\"failed\"]" },
    { "id": "offline", "selector": "[data-cmz-id=\"offline\"]" }
  ],
  "controls": [{ "id": "message", "selector": "[data-cmz-id=\"message\"]" }],
  "actions": [
    { "id": "submit-note", "selector": "[data-cmz-id=\"submit-note\"]" }
  ],
  "data_bindings": [],
  "regions": [{ "id": "main", "selector": "[data-cmz-id=\"main\"]" }],
  "elements": [
    {
      "id": "page-heading",
      "selector": "[data-cmz-id=\"page-heading\"]"
    },
    { "id": "note-form", "selector": "[data-cmz-id=\"note-form\"]" }
  ]
}
